{
  "$schema": "../../schemas/plugin.schema.json",
  "name": "internal-docs",
  "description": "Search architecture decision records, runbooks, and service catalogs from the internal docs portal.",
  "version": "1.2.0",
  "author": {
    "name": "Developer Experience"
  },
  "repository": "https://github.com/your-org/internal-docs-mcp",
  "category": "Onboarding",
  "directory": {
    "sample": true,
    "type": "mcp-server",
    "updated": "2026-08-27"
  }
}
