{
  "$schema": "../../schemas/plugin.schema.json",
  "name": "changelog-writer",
  "description": "Turn a range of commits into a changelog entry written for the people who use the service.",
  "version": "1.3.1",
  "author": {
    "name": "Developer Experience"
  },
  "repository": "https://github.com/your-org/changelog-writer",
  "category": "Delivery",
  "directory": {
    "sample": true,
    "type": "skill",
    "updated": "2026-09-02"
  }
}
