{
  "name": "release-captain",
  "description": "https://example.test/?x=&\"><script type=\"application/json\" data-security-probe=\"description\">\"inert\"</script><meta data-rest=\" Prepare release notes for Acme engineering teams.",
  "version": "2.4.0",
  "author": { "name": "Acme Engineering" },
  "repository": "https://github.com/acme/release-captain",
  "source": {
    "source": "github",
    "repo": "acme/release-captain",
    "sha": "aaaaaaaaaaaaaaaaaaaaaaaaaaaaaaaaaaaaaaaa"
  },
  "category": "Delivery",
  "directory": {
    "type": "plugin",
    "updated": "2026-09-15",
    "contains": { "skills": 2, "agents": 1 }
  }
}
